{
  "id": "2110309313898279395",
  "date": "2026-10-14T09:58:42.000Z",
  "source": "x",
  "lien": "https://x.com/davidlisnard/status/2110309313898279395",
  "statut": "ok",
  "resume": "Partage d'un article de la radio ICI (Lozère) annonçant que le maire de Mende, Patrice Saint-Léger, soutient et parraine la candidature de l'auteur pour la présidentielle de 2027, présenté comme un signe de « mobilisation du terrain ». Aucune mesure de politique publique.",
  "base_du_resume": "texte de la publication et aperçu du lien joint (titre et description de l'article ICI)",
  "citations": [
    "Partout la mobilisation du terrain s’amplifie"
  ],
  "analyse_realisee": false,
  "propositions": [],
  "sources": [],
  "analyse_ia": true,
  "avertissement": "Analyse générée par IA, peut contenir des erreurs.",
  "genere_le": "2026-10-14T14:10:00+02:00",
  "genere_par": "Grok Bot (routine Veille Lisnard 2026-10-14 13:47)",
  "integration": {
    "type": "x",
    "id": "2110309313898279395"
  },
  "notes": "Publication de campagne (soutien d'un élu) ; l'article lui-même n'a pas été consulté au-delà de son aperçu."
}
