{
  "id": "2109332741942804960",
  "date": "2026-10-11T17:18:09.000Z",
  "source": "x",
  "lien": "https://x.com/davidlisnard/status/2109332741942804960",
  "statut": "ok",
  "resume": "Annonce, accompagnée d'une vidéo, de la parution prochaine (fin du mois) d'un livre de l'auteur aux éditions Fayard, intitulé « Les robots, le pape, l’IA et nous ». Le texte ne détaille aucune mesure.",
  "base_du_resume": "texte de la publication (collecté via MCP X natif) ; la vidéo jointe n'a pas été analysée",
  "citations": [
    "Bientôt en librairie (fin du mois), aux @EditionsFayard, « Les robots, le pape, l’IA et nous »."
  ],
  "analyse_realisee": false,
  "propositions": [],
  "sources": [],
  "analyse_ia": true,
  "avertissement": "Analyse générée par IA, peut contenir des erreurs.",
  "genere_le": "2026-10-12",
  "genere_par": "Grok Bot (routine de collecte X du 12/10/2026)",
  "integration": {
    "type": "x",
    "id": "2109332741942804960"
  },
  "notes": "Annonce de publication d'un livre, sans proposition de politique publique : pas d'analyse de faisabilité. La vidéo jointe n'a pas été collectée ni analysée ; le contenu du livre n'est pas connu."
}
