{
  "id": "7700120436046073120",
  "date": "2026-10-24T06:40:05+00:00",
  "source": "tiktok",
  "lien": "https://www.tiktok.com/@david.lisnard/video/7700120436046073120",
  "statut": "ok",
  "integration": {"type": "tiktok", "id": "7700120436046073120"},
  "resume": "Vidéo d'environ 49 s annonçant, d'après sa légende, quatre pages d'interview dans Le Figaro Magazine consacrées aux émeutes, à la situation du pays, aux enjeux de l'IA et de la robotique et à la démarche de l'auteur pour l'avenir du pays. Aucune parole exploitable n'a été détectée dans la bande sonore (probablement de la musique) ; le résumé repose sur la légende. Même annonce que la publication X 2113883840867598353.",
  "base_du_resume": "légende de la publication TikTok (aucun sous-titre, aucune parole détectée)",
  "citations": ["Quatre pages d’interview sur les émeutes, la situation du pays, les enjeux de l’IA et de la robotique"],
  "analyse_realisee": false,
  "propositions": [],
  "sources": [],
  "notes": "Résumé seul : annonce de presse, aucune mesure. Renvoie à la carte X 2113883840867598353.",
  "analyse_ia": true,
  "avertissement": "Analyse générée par IA, peut contenir des erreurs.",
  "genere_le": "2026-10-24T10:00:00+02:00",
  "genere_par": "Grok Bot (routine Veille Lisnard 2026-10-24 09:47)"
}
