{
  "id": "david-lisnard-sur-rtl-lordre-conditionne-la-liberte-la-prosperite-et-la-paix",
  "date": "2026-10-23T09:05:13.877Z",
  "source": "site",
  "lien": "https://www.unenouvelleenergie.fr/david-lisnard-sur-rtl-lordre-conditionne-la-liberte-la-prosperite-et-la-paix/",
  "statut": "ok",
  "integration": {
    "type": "none",
    "id": "david-lisnard-sur-rtl-lordre-conditionne-la-liberte-la-prosperite-et-la-paix"
  },
  "titre": "David Lisnard sur RTL : « L’ordre conditionne la liberté, la prospérité et la paix »",
  "resume": "Compte rendu, par le site de Nouvelle Énergie, d'une interview sur RTL. Après une nuit plus calme, l'auteur appelle à ne pas confondre accalmie et retour à l'ordre ; il juge les couvre-feux possibles à titre provisoire. Il défend une nouvelle doctrine d'emploi des forces de l'ordre, une meilleure coordination police-justice avec des sanctions plus rapides, le démantèlement des groupuscules violents d'extrême gauche comme d'extrême droite, 20 000 places de prison et des établissements disciplinaires fermés pour primo-délinquants. Il redit son souhait d'une primaire ouverte et dit qu'il continuera « son chemin » sans primaire.",
  "base_du_resume": "texte de l'article du site Nouvelle Énergie (l'interview elle-même n'a pas été écoutée)",
  "citations": [
    "La sanction doit être beaucoup plus rapide.",
    "Ce qui coûte très, très cher, c'est le désordre."
  ],
  "analyse_realisee": true,
  "propositions": [
    {
      "texte": "Démanteler, lorsque les conditions légales sont réunies, les groupuscules violents d'extrême gauche comme d'extrême droite (« supprimer toutes les factions et groupuscules d'extrême gauche qui pratiquent la violence », selon l'entretien au Point).",
      "cout": "Non établi (renseignement et procédures).",
      "cadre_juridique": "L'article L212-1 du Code de la sécurité intérieure permet de dissoudre par décret en Conseil des ministres une association ou un groupement de fait qui provoque à des agissements violents contre les personnes ou les biens. Le Conseil d'État (9 novembre 2023) a jugé ce texte d'interprétation stricte : la dissolution doit être adaptée, nécessaire et proportionnée ; il a ainsi annulé celle des Soulèvements de la Terre tout en validant d'autres dissolutions.",
      "competence": "État (Président de la République et Conseil des ministres ; contrôle du Conseil d'État).",
      "precedents": "Dissolutions fréquentes de groupements d'ultradroite et d'ultragauche depuis 2019 (par exemple GALE, validée en 2023) ; annulation pour les Soulèvements de la Terre.",
      "verdict": "faisable_sous_conditions",
      "conditions": [
        "Éléments précis montrant que le groupement lui-même provoque à la violence (pas seulement des actes de certains membres).",
        "Mesure proportionnée, contrôlée par le Conseil d'État.",
        "Suivi de la reconstitution par le renseignement."
      ],
      "fiabilite": "haute",
      "doutes": "Aucun groupement n'est nommé ; la faisabilité dépend de chaque dossier. Les accusations visant des groupes précis pour les violences du 17/10 sont celles de l'auteur et ne sont pas évaluées ici."
    }
  ],
  "sources": [
    {
      "titre": "Conseil d'État – Soulèvements de la Terre, GALE, Alvarium, CRI : critères de dissolution (9 novembre 2023)",
      "url": "https://www.conseil-etat.fr/actualites/soulevements-de-la-terre-gale-alvarium-cri-le-conseil-d-etat-precise-les-criteres-justifiant-la-dissolution-d-une-association-ou-d-un-groupement",
      "consulte_le": "2026-10-23"
    }
  ],
  "notes": "Mesures déjà analysées ailleurs et non réévaluées : doctrine d'emploi des forces de l'ordre (carte X 2111441119066099873), 20 000 places de prison (TikTok 7699201557102972193), établissements disciplinaires fermés (TikTok 7697694581676051745). Couvre-feux et primaire non évalués.",
  "analyse_ia": true,
  "avertissement": "Analyse générée par IA, peut contenir des erreurs.",
  "genere_le": "2026-10-23T14:00:00+02:00",
  "genere_par": "Grok Bot (routine Veille Lisnard 2026-10-23 13:47)"
}