{
  "id": "2113260153583669567",
  "date": "2026-10-22T13:24:17.000Z",
  "source": "x",
  "lien": "https://x.com/davidlisnard/status/2113260153583669567",
  "statut": "ok",
  "integration": {
    "type": "x",
    "id": "2113260153583669567"
  },
  "resume": "Réaction (citation d'une publication de BFMTV) à la recommandation de la préfecture de police de Paris invitant les commerçants à recourir à des agents de sécurité privée avant la mobilisation du 24 octobre. L'auteur y voit un « aveu d'impuissance » : les commerçants paieraient une troisième fois (réparations, impôts, sécurité privée), au détriment d'abord des plus modestes. Il appelle, avec Nouvelle Énergie, à « restaurer vite l'État », sans mesure précise.",
  "base_du_resume": "texte complet de la publication (note_tweet) et publication BFMTV citée",
  "citations": [
    "Inacceptable aveu d'impuissance et renversement total des principes.",
    "restaurons vite l'Etat"
  ],
  "analyse_realisee": false,
  "propositions": [],
  "sources": [
    {
      "titre": "BFMTV – Avancer la fermeture, recours à de la sécurité privée... Les conseils de la préfecture de police aux commerçants avant la manifestation de samedi à Paris (22/10/2026)",
      "url": "https://www.bfmtv.com/police-justice/avancer-la-fermeture-recours-a-de-la-securite-privee-les-conseils-de-la-prefecture-de-police-aux-commercants-avant-la-manifestation-de-samedi-a-paris_AV-202610220597.html",
      "consulte_le": "2026-10-22"
    },
    {
      "titre": "La Montagne – Mobilisation du 24 octobre : à Paris, la préfecture recommande aux commerçants de faire appel à des agents de sécurité privée (22/10/2026)",
      "url": "https://www.lamontagne.fr/france-monde/faits-divers/mobilisation-du-24-octobre-a-paris-la-prefecture-recommande-aux-commercants-de-faire-appel-a-des-agents-de-securite-privee_15067913/",
      "consulte_le": "2026-10-22"
    },
    {
      "titre": "Service-public (Vias) – Modalités d'exercice des activités privées de sécurité",
      "url": "https://sites.service-information-publique.fr/vias/guide-professionnels/F24457.html",
      "consulte_le": "2026-10-22"
    }
  ],
  "notes": "Résumé seul : critique et orientation générale, aucune mesure concrète à évaluer. Contexte vérifié : courrier du préfet de police (21/10) recommandant notamment des agents de sécurité privée et indiquant que les forces de l'ordre « ne peuvent garantir à elles seules la protection de chaque établissement ». Un gardiennage sur la voie publique reste soumis à autorisation préalable du préfet de police.",
  "analyse_ia": true,
  "avertissement": "Analyse générée par IA, peut contenir des erreurs.",
  "genere_le": "2026-10-22T18:05:00+02:00",
  "genere_par": "Grok Bot (routine Veille Lisnard 2026-10-22 17:47)"
}