{
  "id": "2115694273345855820",
  "date": "2026-10-29T06:36:37+00:00",
  "source": "x",
  "lien": "https://x.com/davidlisnard/status/2115694273345855820",
  "statut": "ok",
  "integration": {
    "type": "x",
    "id": "2115694273345855820"
  },
  "resume": "Publication courte (« Toc toc, on frappe à la porte ») qui cite un message de Sud Radio du 28 octobre 2026. Ce message rapporte une phrase de Patrick Sébastien dans l'émission « À vous de le dire » : « Si je devais voter aujourd'hui, je voterais pour @davidlisnard ».",
  "base_du_resume": "texte de la publication X et texte de la publication citée (compte Sud Radio, 2115401889852584055)",
  "citations": [
    "Toc toc, on frappe à la porte",
    "Si je devais voter aujourd'hui, je voterais pour @davidlisnard"
  ],
  "analyse_realisee": false,
  "propositions": [],
  "sources": [
    {"titre": "Publication citée de Sud Radio (28/10/2026)", "url": "https://x.com/SudRadio/status/2115401889852584055"}
  ],
  "notes": "Résumé seul : partage d'un soutien exprimé par un tiers, aucune mesure. La citation de Patrick Sébastien est rapportée par Sud Radio ; l'extrait audio ou vidéo n'a pas été consulté ici.",
  "analyse_ia": true,
  "avertissement": "Analyse générée par IA, peut contenir des erreurs.",
  "genere_le": "2026-10-29T09:55:00+01:00",
  "genere_par": "Grok Bot (routine Veille Lisnard 2026-10-29 09:47)"
}
