{
  "id": "2111422624798556180",
  "date": "2026-10-17T11:42:36.000Z",
  "source": "x",
  "lien": "https://x.com/davidlisnard/status/2111422624798556180",
  "statut": "ok",
  "integration": {
    "type": "x",
    "id": "2111422624798556180"
  },
  "resume": "Citation d'une publication de Catherine Pégard qui apporte son soutien aux journalistes empêchés d'exercer et qualifie d'inacceptables les violences subies ces dernières semaines sur le terrain par des journalistes de plusieurs médias (BFM, CNews, LCI, M6, ICI). L'auteur exprime son « total soutien ». Prise de position, aucune mesure de politique publique.",
  "base_du_resume": "texte de la publication et de la publication citée (texte complet)",
  "citations": [
    "Rappel utile et nécessaire",
    "Total soutien"
  ],
  "analyse_realisee": false,
  "propositions": [],
  "sources": [],
  "notes": "Les faits de violences évoqués dans la publication citée n'ont pas été vérifiés ici.",
  "analyse_ia": true,
  "avertissement": "Analyse générée par IA, peut contenir des erreurs.",
  "genere_le": "2026-10-17T14:00:00+02:00",
  "genere_par": "Grok Bot (routine Veille Lisnard 2026-10-17 13:47)"
}