{
  "id": "a-cannes-les-collegiens-sensibilises-a-la-liberte-dexpression-et-a-lassassinat-d",
  "date": "2026-10-06T14:36:36.301Z",
  "source": "site",
  "lien": "https://www.unenouvelleenergie.fr/a-cannes-les-collegiens-sensibilises-a-la-liberte-dexpression-et-a-lassassinat-de-samuel-paty/",
  "statut": "ok",
  "resume": "Compte rendu de la projection du film « L'Abandon » (Vincent Garenq) à tous les élèves de 3e de Cannes le 5 octobre, six ans après le cours de Samuel Paty, avec l'Académie de Nice, l'équipe du film et la sœur de Samuel Paty. L'article rattache l'initiative à la politique « 100 % Éducation Artistique et Culturelle » de la ville.",
  "base_du_resume": "texte de l'article du site Nouvelle Énergie",
  "analyse_realisee": false,
  "propositions": [],
  "sources": [],
  "analyse_ia": true,
  "avertissement": "Analyse générée par IA, peut contenir des erreurs.",
  "genere_le": "2026-10-10",
  "genere_par": "Grok Bot (prototype, recherches web du 10/10/2026)",
  "titre": "1 000 collégiens cannois découvrent le film «L’Abandon» sur Samuel Paty",
  "integration": {
    "type": "none",
    "id": "a-cannes-les-collegiens-sensibilises-a-la-liberte-dexpression-et-a-lassassinat-d"
  },
  "notes": "Action municipale réalisée ; aucune proposition nouvelle."
}