{
  "id": "2108303752990220619",
  "date": "2026-10-08T21:09:19.000Z",
  "source": "x",
  "lien": "https://x.com/davidlisnard/status/2108303752990220619",
  "statut": "ok",
  "resume": "Après l'échec du SCAF, l'auteur voit dans le MGCS (char du futur franco-allemand, lancé en 2017-2018) une seconde impasse industrielle et stratégique. Il critique une coopération érigée en objectif politique avant d'avoir vérifié la convergence des intérêts militaires, la maîtrise des technologies et les responsabilités industrielles. Il relaie l'idée, issue d'un séminaire franco-allemand du 7 octobre, de partir des besoins opérationnels et des intérêts industriels avant toute traduction politique. Il demande que la France prépare « sans délai » le remplacement du Leclerc par un système complet (blindés, drones, robotique, IA, maîtrise des données), exige l'efficacité de chaque euro de défense et lie redressement des finances publiques et réindustrialisation à la souveraineté.",
  "base_du_resume": "texte complet de la publication (collecté via MCP X natif) (≈4 000 caractères)",
  "analyse_realisee": true,
  "propositions": [
    {
      "texte": "Préparer « sans délai » le renouvellement de la capacité de combat terrestre française, conçu comme un système complet (blindés, drones, robotique, IA, maîtrise des données) et non un simple remplacement du Leclerc.",
      "cout": "Non établi : aucun chiffrage du programme n'est fourni par la publication ni trouvé dans les sources consultées. Repère de contexte : la loi du 18 août 2026 actualisant la LPM 2024-2030 porterait les crédits de la mission Défense à 435,7 Md€ sur la période (+36 Md€ sur 2026-2030), d'après un extrait de recherche du JO ; ce montant n'est pas ventilé par programme.",
      "cadre_juridique": "Loi de programmation militaire (l'article 34 de la Constitution prévoit des lois de programmation et fixe les principes de l'organisation générale de la défense nationale) ; loi de finances annuelle pour les crédits. Si le programme est conduit avec un partenaire, un accord international (art. 52-55 de la Constitution) est nécessaire. Droit de l'UE (règles d'achats de défense, financements européens) : non établi.",
      "competence": "État (Gouvernement, ministère des Armées/DGA, Parlement pour la LPM). Ni les collectivités ni l'UE n'ont de compétence directe sur le choix d'un programme national d'armement.",
      "precedents": "France : le plan intermédiaire « Capint » (capacité intermédiaire, de transition) présenté par KNDS en juin 2026 est décrit par BFM Business comme un « plan B » de Paris, apte à intégrer de façon incrémentale des fonctions du MGCS. Le MGCS lui-même (lancé en 2018) est présenté par franceinfo et BFM comme en difficulté ; l'état-major l'a décrit le 8 oct. comme quitté par l'Allemagne, puis les ministres français et allemand ont affirmé le 9 oct. qu'il est « maintenu » et simplement décalé (mise en service vers la fin des années 2040 selon le communiqué du CEMA cité par BFM). Étranger : projet allemand Leopard 3 évoqué par l'auteur ; non vérifié par une source consultée. Autres précédents : non établi.",
      "verdict": "faisable_sous_conditions",
      "conditions": [
        "Financement garanti en loi de programmation militaire et en lois de finances, dans un contexte de finances publiques contraintes (non chiffré ici).",
        "Capacité industrielle nationale (maîtrise des technologies, rôle des industriels) à confirmer : la publication la présente comme acquise, ce que les sources consultées ne permettent pas de vérifier.",
        "Clarification du statut du MGCS : les autorités françaises et allemandes affirment le 9 oct. 2026 qu'il se poursuit ; un programme national parallèle supposerait d'arbitrer entre les deux voies.",
        "Calendrier long : le MGCS visait une mise en service vers 2040, désormais vers la fin des années 2040."
      ],
      "fiabilite": "moyenne",
      "doutes": "Situation évolutive (annonces contradictoires des 8 et 9 oct. 2026). Aucun chiffrage de programme trouvé. L'article du Monde n'a pas pu être consulté (page non chargée)."
    },
    {
      "texte": "Fonder la coopération d'armement sur les besoins opérationnels et les intérêts industriels, puis lui donner une traduction politique « lorsque cela est justifié » (le pouvoir politique fixe les ambitions et garantit les moyens ; les armées définissent les besoins ; les industriels construisent).",
      "cout": "non établi",
      "cadre_juridique": "Mesure de méthode ne requérant pas de texte nouveau ; les coopérations internationales restent régies par des accords soumis, selon les cas, à l'article 53 de la Constitution.",
      "competence": "État ; partenaires étrangers pour toute coopération bilatérale.",
      "precedents": "Le communiqué du chef d'état-major cité par BFM Business évoque un MGCS « recentré » sur la connectivité, le combat collaboratif, l'automatisation et la robotisation ; la publication attribue à un séminaire du 7 octobre une approche proche (non confirmé par une source consultée). Autres précédents : non établi.",
      "verdict": "faisable_sous_conditions",
      "conditions": [
        "Accord du ou des partenaires sur la méthode (non établi à ce stade).",
        "Capacité à arbitrer entre intérêts industriels nationaux divergents, difficulté déjà relevée par BFM Business (arrivée de Rheinmetall en 2019, tensions de répartition)."
      ],
      "fiabilite": "moyenne",
      "doutes": "Proposition de nature méthodologique ; l'évaluation de faisabilité reste qualitative."
    }
  ],
  "sources": [
    {
      "titre": "« Les Allemands ont décidé de quitter le projet » : l'imbroglio du char du futur franco-allemand (BFM Business, 9 oct. 2026)",
      "url": "https://www.bfmtv.com/economie/entreprises/defense/les-allemands-ont-decide-de-quitter-le-projet-l-imbroglio-du-char-du-futur-franco-allemand-enterre-puis-ressuscite-en-quelques-heures_AV-202610090383.html",
      "consulte_le": "2026-10-10"
    },
    {
      "titre": "La France et l'Allemagne assurent que le projet commun MGCS du futur char est bien maintenu (franceinfo, 9 oct. 2026)",
      "url": "https://www.franceinfo.fr/societe/armee-securite-defense/paris-et-berlin-assurent-que-le-projet-mgcs-du-futur-char-franco-allemand-est-bien-maintenu_8230096.html",
      "consulte_le": "2026-10-10"
    },
    {
      "titre": "Loi n° 2026-791 actualisant la programmation militaire (JO du 18 août 2026, extrait via FHF)",
      "url": "https://www.fhf.fr/sites/default/files/2026-08/Loi%20n%C2%B02026-791%20-%20programmation%20militaire_3.pdf",
      "consulte_le": "2026-10-10"
    },
    {
      "titre": "Constitution du 4 octobre 1958 (texte en vigueur) – Conseil constitutionnel",
      "url": "https://www.conseil-constitutionnel.fr/le-bloc-de-constitutionnalite/texte-integral-de-la-constitution-du-4-octobre-1958-en-vigueur",
      "consulte_le": "2026-10-10"
    }
  ],
  "analyse_ia": true,
  "avertissement": "Analyse générée par IA, peut contenir des erreurs.",
  "genere_le": "2026-10-10",
  "genere_par": "Grok Bot (prototype, recherches web du 10/10/2026)",
  "integration": {
    "type": "x",
    "id": "2108303752990220619"
  },
  "citations": [
    "Après le SCAF, le MGCS.",
    "La coopération doit renforcer notre puissance, jamais conditionner notre liberté de décision."
  ],
  "notes": "Les sources de contexte sur le MGCS sont des médias (usage limité à la vérification des faits d'actualité ; la collecte des publications, elle, reste limitée aux comptes officiels). Le montant LPM provient d'un extrait de recherche, non d'une lecture intégrale du Journal officiel."
}