{
  "id": "7700185424945270048",
  "date": "2026-10-24T10:52:13+00:00",
  "source": "tiktok",
  "lien": "https://www.tiktok.com/@david.lisnard/video/7700185424945270048",
  "statut": "ok",
  "integration": {
    "type": "tiktok",
    "id": "7700185424945270048"
  },
  "resume": "Vidéo d'environ 39 s, sans légende, extraite d'une intervention (émission non précisée). À partir de son expérience d'ancien commerçant, l'auteur oppose un État jugé « implacable » dans ses contrôles (contrôle fiscal, Urssaf, inspection du travail, retard de TVA) à un État qui, selon lui, ne protège plus. Il plaide, en reprenant une formule attribuée à Georges Pompidou, pour « moins d'État » tracassier et « beaucoup plus d'État » recentré sur ses missions régaliennes.",
  "base_du_resume": "sous-titres automatiques TikTok (non relus)",
  "citations": [
    "cet État qui me contrôle ne me protège pas",
    "recentré sur ses missions régaliennes"
  ],
  "analyse_realisee": false,
  "propositions": [],
  "sources": [],
  "notes": "Résumé seul : orientation générale (recentrage de l'État sur le régalien), sans mesure précise évaluable. Citations reformulées à la marge depuis des sous-titres automatiques non relus. Transcription non commitée.",
  "analyse_ia": true,
  "avertissement": "Analyse générée par IA, peut contenir des erreurs.",
  "genere_le": "2026-10-24T13:55:00+02:00",
  "genere_par": "Grok Bot (routine Veille Lisnard 2026-10-24 13:47)"
}
