{
  "id": "2113397095940120619",
  "date": "2026-10-22T22:28:27.000Z",
  "source": "x",
  "lien": "https://x.com/davidlisnard/status/2113397095940120619",
  "statut": "ok",
  "integration": {
    "type": "x",
    "id": "2113397095940120619"
  },
  "resume": "Compte rendu d'une soirée à Cannes avec le maire de Shizuoka (ville jumelle), l'ambassadeur du Japon en France et le consul du Japon à Marseille, présentée comme un « nouvel élan » de la coopération décentralisée franco-japonaise. L'auteur insiste sur les intérêts stratégiques communs (présence française dans le Pacifique, liberté de navigation en Indopacifique) et appelle de façon générale à renforcer les coopérations technologiques (IA, semi-conducteurs, robotique, quantique, spatial, nucléaire) et les liens entre démocraties.",
  "base_du_resume": "texte complet de la publication (note_tweet), accompagné de 4 photos",
  "citations": [
    "La sécurité du Japon engage celle de la France.",
    "La souveraineté se construit par des compétences, des investissements et des actes."
  ],
  "analyse_realisee": false,
  "propositions": [],
  "sources": [],
  "notes": "Résumé seul : orientations générales (coopérations à renforcer) sans mesure précise ni chiffrage. Les noms et fonctions des invités proviennent de la publication et n'ont pas été vérifiés.",
  "analyse_ia": true,
  "avertissement": "Analyse générée par IA, peut contenir des erreurs.",
  "genere_le": "2026-10-23T10:00:00+02:00",
  "genere_par": "Grok Bot (routine Veille Lisnard 2026-10-23 09:47)"
}