{
  "id": "7699445115420560673",
  "date": "2026-10-22T10:59:27+00:00",
  "source": "tiktok",
  "lien": "https://www.tiktok.com/@david.lisnard/video/7699445115420560673",
  "statut": "ok",
  "integration": {
    "type": "tiktok",
    "id": "7699445115420560673"
  },
  "resume": "Vidéo courte (~63 s, sans légende). L'auteur conteste que la répression de la manifestation de 1961 (guerre d'Algérie) puisse justifier les pillages, les violences contre les policiers et l'incendie d'un hôtel de ville survenus le 17 octobre 2026. Il exprime de la « compassion » pour les victimes de drames historiques, qu'il cite avec des Italiens tués au XIXe siècle, mais accuse l'extrême gauche d'entretenir une « culture de la victimisation » et refuse de « s'excuser ».",
  "base_du_resume": "sous-titres automatiques TikTok (non relus), pas de légende",
  "citations": [
    "on ne va pas s'excuser",
    "n'essayez pas de détourner l'opinion"
  ],
  "analyse_realisee": false,
  "propositions": [],
  "sources": [],
  "notes": "Résumé seul : prise de position, aucune mesure concrète. La date « 1883 » pour les Italiens tués figure telle quelle dans les sous-titres automatiques non relus ; le massacre d'Italiens le plus connu en France (Aigues-Mortes) date de 1893 : erreur de sous-titres ou de propos non vérifiable ici. Transcription non relue, non commitée.",
  "analyse_ia": true,
  "avertissement": "Analyse générée par IA, peut contenir des erreurs.",
  "genere_le": "2026-10-22T18:05:00+02:00",
  "genere_par": "Grok Bot (routine Veille Lisnard 2026-10-22 17:47)"
}