{
  "id": "2110685051273064894",
  "date": "2026-10-15T10:51:45.000Z",
  "source": "x",
  "lien": "https://x.com/davidlisnard/status/2110685051273064894",
  "statut": "ok",
  "integration": {
    "type": "x",
    "id": "2110685051273064894"
  },
  "resume": "Courte publication accompagnée d'une vidéo : l'auteur critique l'intervention du président du Conseil constitutionnel, Richard Ferrand, qui a déclaré pendant la campagne présidentielle qu'on ne peut pas réviser la Constitution par un référendum fondé sur l'article 11. Aucune mesure de politique publique.",
  "base_du_resume": "texte de la publication (la vidéo jointe n'a pas été transcrite ici ; le même sujet est traité dans la vidéo TikTok 7696835961484954913)",
  "citations": [
    "Richard Ferand a donc décidé d’intervenir dans le débat présidentiel et de délivrer par lui-même un point de doctrine constitutionnelle."
  ],
  "analyse_realisee": false,
  "propositions": [],
  "sources": [
    {
      "titre": "Référendum : le président du Conseil constitutionnel s'oppose aux projets de Le Pen (AFP via France 24, 13 oct. 2026)",
      "url": "https://www.france24.com/fr/info-en-continu/20261013-r%C3%A9f%C3%A9rendum-le-pr%C3%A9sident-du-conseil-constitutionnel-s-oppose-aux-projets-de-le-pen-col%C3%A8re-au-rn",
      "consulte_le": "2026-10-15"
    },
    {
      "titre": "Constitution du 4 octobre 1958 (texte en vigueur) – Conseil constitutionnel",
      "url": "https://www.conseil-constitutionnel.fr/le-bloc-de-constitutionnalite/texte-integral-de-la-constitution-du-4-octobre-1958-en-vigueur",
      "consulte_le": "2026-10-15"
    }
  ],
  "notes": "Nom orthographié « Ferand » dans la publication (il s'agit de Richard Ferrand). Selon l'AFP, ses propos ont été tenus dans un podcast du Club des juristes diffusé avec BFM ; il y présente l'article 89 comme la seule voie de révision de la Constitution.",
  "analyse_ia": true,
  "avertissement": "Analyse générée par IA, peut contenir des erreurs.",
  "genere_le": "2026-10-15T14:20:00+02:00",
  "genere_par": "Grok Bot (routine Veille Lisnard 2026-10-15 13:47, recherche web)"
}
