{
  "id": "7700215923717852448",
  "date": "2026-10-24T12:50:35+00:00",
  "source": "tiktok",
  "lien": "https://www.tiktok.com/@david.lisnard/video/7700215923717852448",
  "statut": "ok",
  "integration": {
    "type": "tiktok",
    "id": "7700215923717852448"
  },
  "resume": "Vidéo d'environ 28 s, sans légende, tournée dans une gare (ville non précisée dans la vidéo) le jour de la mobilisation du 24 octobre. L'auteur décrit un « gros dispositif de sécurité » mis en place avec l'État, remercie police nationale, gendarmes et policiers municipaux, juge la situation « très positive » et appelle à rester mobilisé les prochains samedis et jours de manifestation, ainsi qu'à fréquenter les commerces.",
  "base_du_resume": "sous-titres automatiques TikTok (non relus)",
  "citations": [
    "la situation est très positive",
    "allons chez nos commerçants",
    "vive l'ordre au service de nos libertés"
  ],
  "analyse_realisee": false,
  "propositions": [],
  "sources": [],
  "notes": "Résumé seul : message de terrain (remerciements aux forces de l'ordre, appel à fréquenter les commerces), sans mesure précise évaluable. Lieu exact non vérifié. Citations reformulées à la marge depuis des sous-titres automatiques non relus. Transcription non commitée.",
  "analyse_ia": true,
  "avertissement": "Analyse générée par IA, peut contenir des erreurs.",
  "genere_le": "2026-10-24T17:55:00+02:00",
  "genere_par": "Grok Bot (routine Veille Lisnard 2026-10-24 17:47)"
}
